Topic_Id,Topic_Keywords,Num_Documents,Perc_Documents,Relevance (SY),LW comments
233,"dynamic, time, understanding, equilibrium, interaction, field, theoretical, fundamental, phenomenon, static",17,0.0006,No,
234,"flow, fluid, scale, wall, boundary, turbulent, turbulence, dynamic, mixing, transport",78,0.0026,No,
235,"multi, approach, disciplinary, inter, based, integrated, level, innovative, address, multiple",7,0.0002,No,
236,"behaviour, spatial, pattern, temporal, distribution, dynamic, model, approach, resolution, investigate",10,0.0003,Yes,
237,"wide, range, potential, future, variety, broad, including, emerging, spectrum, aim",6,0.0002,No,
238,"small, unit, plasma, medium, high, current, based, sized, developed, advantage",5,0.0002,No,
239,"performance, architecture, computing, high, system, application, hpc, design, efficient, parallel",88,0.0029,No,
240,"regulatory, regulation, factor, transcription, regulator, transcriptional, specific, aim, approach, activity",47,0.0016,Yes,
241,"child, family, early, adult, development, infant, young, parent, childhood, developmental",97,0.0032,Yes,
242,"galaxy, black, star, universe, hole, gravity, gravitational, survey, cosmic, physic",249,0.0083,No,
243,"smart, iot, internet, thing, platform, solution, device, service, connected, technology",120,0.004,Yes,
244,"level, approach, specific, aim, higher, provide, relevant, order, develop, focus",2,0.0001,No,
245,"property, material, crystal, scale, structure, physical, fundamental, phase, technique, soft",102,0.0034,No,
246,"failure, damage, seismic, fault, earthquake, strain, deformation, induced, fatigue, zone",101,0.0034,No,
247,"risk, management, assessment, resilience, asset, framework, disaster, tool, measure, flood",92,0.0031,No,
248,"climate, model, uncertainty, extreme, weather, atmospheric, forecast, aerosol, impact, prediction",165,0.0055,No,
249,"year, death, stroke, million, increase, risk, leading, number, common, problem",30,0.001,Yes,
250,"point, set, view, starting, key, aim, including, relevant, result, provide",3,0.0001,No,
251,"innovation, open, ecosystem, creation, support, create, digital, community, collaborative, initiative",106,0.0035,No,
252,"track, record, highly, innovative, including, developing, proven, develop, developed, provide",2,0.0001,No,
253,"increase, efficiency, reduce, improve, increased, increasing, cost, improving, reducing, efficient",6,0.0002,No,
254,"diagnostic, diagnosis, diagnostics, cancer, early, screening, clinical, detection, biomarkers, disease",313,0.0104,Yes,
255,"technology, key, development, advanced, technological, enabling, industry, developing, disruptive, future",9,0.0003,Yes,
256,"europe, european, start, support, access, hub, tech, business, stop, entrepreneur",63,0.0021,No,
257,"solar, cell, efficiency, pv, energy, material, photovoltaic, conversion, perovskite, efficient",226,0.0075,No,
258,"research, field, lab, advance, area, proposal, living, proposed, emerging, expertise",7,0.0002,No,
259,"researcher, event, public, science, night, people, activity, european, young, awareness",198,0.0066,No,
260,"research, centre, excellence, university, innovation, scientific, institute, institution, leading, partner",240,0.008,No,
261,"module, technology, integrated, system, prototype, advanced, design, component, demonstrator, concept",29,0.001,Yes,
262,"interaction, mechanism, understanding, study, experiment, investigate, approach, experimental, underlying, insight",6,0.0002,Yes,
263,"force, mechanical, shape, matrix, mechanic, property, controlled, ecm, tube, orientation",52,0.0017,Yes,
264,"history, century, historical, modern, religious, early, period, study, medieval, political",458,0.0152,No,
265,"service, business, customer, company, platform, market, online, consumer, user, marketing",269,0.0089,No,
266,"life, ageing, people, age, population, aging, related, elderly, older, living",97,0.0032,Yes,
267,"engine, noise, design, aircraft, high, test, tunnel, configuration, wing, performance",238,0.0079,No,
268,"data, big, analytics, analysis, collection, driven, collected, information, collect, management",98,0.0033,Yes,
269,"paradigm, principle, approach, complex, challenge, fundamental, shift, advance, complexity, understanding",5,0.0002,No,
270,"law, legal, conflict, international, violence, practice, justice, case, norm, society",157,0.0052,No,
271,"exchange, partner, activity, training, international, capacity, staff, collaboration, knowledge, consortium",74,0.0025,No,
272,"protection, privacy, trust, data, compliance, personal, crime, legal, case, regulation",120,0.004,Yes,
273,"practice, policy, support, implementation, peer, measure, eu, experience, public, agency",87,0.0029,No,
274,"body, identification, recognition, based, develop, profile, highly, method, result, lack",15,0.0005,Yes,
275,"order, result, main, improvement, achieve, objective, effort, current, higher, required",6,0.0002,No,
276,"test, testing, tested, validation, result, lab, performed, standard, developed, kit",28,0.0009,yes,
277,"structure, structural, complex, technique, architecture, method, proposal, element, approach, complexity",6,0.0002,No,
278,"global, africa, south, europe, world, country, north, african, asia, america",46,0.0015,No,
279,"design, engineering, optimal, engineer, designing, tool, optimization, methodology, based, designed",32,0.0011,No,
280,"language, speech, linguistic, word, natural, meaning, semantic, translation, sign, voice",207,0.0069,Yes,
281,"cross, border, common, including, focus, approach, aim, area, key, level",8,0.0003,No,
282,"security, cyber, secure, threat, attack, physical, critical, infrastructure, cybersecurity, protection",211,0.007,No,
283,"topological, matter, phase, state, physic, property, system, electron, material, correlated",244,0.0081,No,
284,"system, complex, complexity, physical, component, embedded, increasingly, traditional, limit, requires",2,0.0001,No,
285,"work, worker, labour, working, job, productivity, market, employment, skill, associate",59,0.002,No,
286,"carbon, forest, tree, global, flux, climate, co2, change, cycle, ecosystem",173,0.0058,No,
287,"market, phase, company, sme, technology, business, instrument, plan, product, prototype",149,0.005,No,
288,"alternative, frame, panel, based, aim, result, provide, produce, current, generate",30,0.001,NO,
289,"diabetes, disease, obesity, glucose, type, insulin, factor, risk, metabolic, beta",138,0.0046,Yes,
290,"approach, diversity, understanding, diverse, research, aim, perspective, provide, multidisciplinary, relationship",6,0.0002,No,
291,"skin, pain, regeneration, wound, healing, injury, chronic, spinal, peripheral, cord",98,0.0033,Yes,
292,"oil, friendly, eco, industry, innovative, environmental, environmentally, alternative, environment, high",42,0.0014,No,
293,"strategy, needed, target, anti, effective, identify, global, tb, identified, potential",22,0.0007,No,
294,"data, database, information, web, tool, open, analysis, access, datasets, existing",88,0.0029,Yes,
295,"primary, mining, secondary, rare, critical, exploration, mineral, resource, source, drilling",55,0.0018,No,
296,"magnetic, field, spin, magnet, resonance, electric, effect, property, current, polarization",138,0.0046,No,
297,"virus, vaccine, disease, infection, viral, vector, human, hiv, infectious, pathogen",226,0.0075,Yes,
298,"light, led, shed, lighting, colour, display, oled, uv, visible, emitting",76,0.0025,Yes,
299,"research, science, philosophy, practice, relation, conceptual, knowledge, understanding, methodological, nature",100,0.0033,No,